{
  "artifacts": [
    {
      "path": "assets/catalog.json",
      "role": "assets",
      "sha256": "15d6b6cb0528af01a74755c332481e8544c36d87ca53a93beb8c34f068851b20"
    },
    {
      "path": "assets/fonts/gfsdidot/DESCRIPTION.en_us.html",
      "role": "assets",
      "sha256": "9aa61fa5d8872f9cab53be3ff1e040abbd0af0931207bd6ea9d297ef89506223"
    },
    {
      "path": "assets/fonts/gfsdidot/GFSDidot-Regular.ttf",
      "role": "assets",
      "sha256": "4fc784ab824e8866eeef8ad55976b93e7e170fb1b8237fd4f8781b5b4dd297f9"
    },
    {
      "path": "assets/fonts/gfsdidot/METADATA.pb",
      "role": "assets",
      "sha256": "aa07c9c90cea6cc13577262558cd366c2fdee90b57e6f75d752f010ff0f6b751"
    },
    {
      "path": "assets/fonts/gfsdidot/OFL.txt",
      "role": "assets",
      "sha256": "9e19c0d2e7e7adcbe9dfd0749e34dda41e7e356e0f2cc082d61d2fc9b6e0cef7"
    },
    {
      "path": "assets/fonts/oldstandardtt/DESCRIPTION.en_us.html",
      "role": "assets",
      "sha256": "8f890b4a6c93591c47c6a8c39b55ff7a7509a520dee29176243634258a86cb57"
    },
    {
      "path": "assets/fonts/oldstandardtt/METADATA.pb",
      "role": "assets",
      "sha256": "c2893bc801b26ce6017f8983b8c5c7fb3198d0b6b4f2bde2c185201921eba91d"
    },
    {
      "path": "assets/fonts/oldstandardtt/OFL.txt",
      "role": "assets",
      "sha256": "4faa2d9e2ce0a4b5b37e62ee6fafe474a539b31578f7214ed97cc3503aeb8ebd"
    },
    {
      "path": "assets/fonts/oldstandardtt/OldStandard-Bold.ttf",
      "role": "assets",
      "sha256": "7d831e9d799ad23ee98e889381a9db2a283b2dac7f228dd5c06071decb9c54db"
    },
    {
      "path": "assets/fonts/oldstandardtt/OldStandard-Italic.ttf",
      "role": "assets",
      "sha256": "4b9522f4711317fc06e2413a58b4662c249cb707df193d682b9d640e365ef564"
    },
    {
      "path": "assets/fonts/oldstandardtt/OldStandard-Regular.ttf",
      "role": "assets",
      "sha256": "42717a1280b523a506ca2b0285cca380e77fe214b1f6e3d75a8b925005f19eac"
    },
    {
      "path": "assets/template-NOTICE.txt",
      "role": "assets",
      "sha256": "62b0f4bc3bc1a43f19db3653d026273378fd839c98635868081e964491f0a831"
    },
    {
      "path": "assets/template.json",
      "role": "assets",
      "sha256": "40930732fb78ec63f0fd9e75aa694962512357dabf47d1889ad2eca920d47045"
    },
    {
      "path": "assets/texts/CC0-1.0.txt",
      "role": "assets",
      "sha256": "a2010f343487d3f7618affe54f789f5487602331c0a8d03f49e9a7c547cf0499"
    },
    {
      "path": "assets/texts/NOTICE.md",
      "role": "assets",
      "sha256": "b2ce6e45a24ee9c034039d18450ec8c6d2611319bfb7a7b8801f8139926dd014"
    },
    {
      "path": "assets/texts/annonces-fr.txt",
      "role": "assets",
      "sha256": "7881bb7fca96af44c294f8a6603f924eee958ab5b6394bc7c8b47cf2734af4fc"
    },
    {
      "path": "assets/texts/demo-fr.txt",
      "role": "assets",
      "sha256": "1025138a6e80735785d415c157a91cb856a34a86659ca7a5215193197e992895"
    },
    {
      "path": "assets/texts/titres-fr.txt",
      "role": "assets",
      "sha256": "30f846cdeec76617013e7891dd4c5695c11358b652cceefba20755255d6e0c72"
    },
    {
      "path": "assets.json",
      "role": "assets.json",
      "sha256": "b7f7cbf56034fb07cd04eaeb7f6e7eb25e96ef3604f2b4359ed4cac7f45cf954"
    },
    {
      "path": "calibration/CADRAGE.md",
      "role": "calibration",
      "sha256": "7e9960f8709c3a8415ac142c6b604a7340746e8168e23dfb5f598e95bf1f01c7"
    },
    {
      "path": "calibration/fichiers_lus.tsv",
      "role": "calibration",
      "sha256": "73d4e7abef71200bc078c8a45bc84657bd12b3aba26f70e2e7b89f5bab28073a"
    },
    {
      "path": "config.json",
      "role": "config.json",
      "sha256": "b984106f76b09fb7b92539f1ec682f50a031d72c2f9e3d3b40ac9d339e28e4c7"
    },
    {
      "path": "environment.json",
      "role": "environment.json",
      "sha256": "f6859dd2b3c01f0c19eaea650cbd01847cd2950246b10ab9f3bc38e208caed14"
    },
    {
      "path": "exports/alto/mf_0000.xml",
      "role": "exports",
      "sha256": "95d2e4f922c4f4c8a3232868120895b0376db25df731357fc7cd88c0a556050b"
    },
    {
      "path": "exports/alto/mf_0001.xml",
      "role": "exports",
      "sha256": "c2f1d60108c4c72b15afc2eb5e5ce3460141b160764df48a86ed5394b65ffa46"
    },
    {
      "path": "exports/alto/mf_0002.xml",
      "role": "exports",
      "sha256": "52abb5461c7ec539d73f311613e0a0f36c8b94e4c0ed5ba0ae5171986eb19001"
    },
    {
      "path": "exports/alto/mf_0003.xml",
      "role": "exports",
      "sha256": "211a32f12c3d909ffdc6193ad2f4d564c6f51ae973ea41cd6d3c815f050e884b"
    },
    {
      "path": "exports/alto/mf_0004.xml",
      "role": "exports",
      "sha256": "3eabfaf4ee0416c772972c477afd1d601647ba5540e93ca3096f271864d4d88e"
    },
    {
      "path": "exports/alto/mf_0005.xml",
      "role": "exports",
      "sha256": "81cc226597ed4ba9e8eb3907f8cb0e25dc54168fdb15f04f92743320a66067fe"
    },
    {
      "path": "exports/alto/mf_0006.xml",
      "role": "exports",
      "sha256": "252284e406f55a4e0993a001e7e90cc43b999483369c410cc62cf38f6e85aadb"
    },
    {
      "path": "exports/alto/mf_0007.xml",
      "role": "exports",
      "sha256": "c0787419097b350f99c0b88bf740172b8535e3b15959aae96db846f6578fcc9e"
    },
    {
      "path": "exports/alto/mf_0008.xml",
      "role": "exports",
      "sha256": "decd09da88b2cf7943e2bb51c21f0fb5de008774f1fa8823cc64857befb63609"
    },
    {
      "path": "exports/alto/mf_0009.xml",
      "role": "exports",
      "sha256": "7656c9ba749b937dab1027317eee6d57ee7a69a62eae7289111a4297027cf64e"
    },
    {
      "path": "exports/alto/mf_0010.xml",
      "role": "exports",
      "sha256": "f1c712cd57fdbd42906e20be83e9f14f4817e0a23be961b514d854134a586c48"
    },
    {
      "path": "exports/alto/mf_0011.xml",
      "role": "exports",
      "sha256": "56830b9d9a2e7f02d20aec1d76c46c9ac171782f7aa3361e409d8079e9e16b1b"
    },
    {
      "path": "exports/alto/mf_0012.xml",
      "role": "exports",
      "sha256": "1794a31caf45ca026e56b3ff1ed1f9bce97f4dddca7de8bc00fcf071e636c774"
    },
    {
      "path": "exports/alto/mf_0013.xml",
      "role": "exports",
      "sha256": "efdba91e4d41f469753bc61a0f8c3cdd526c8a11bf305d313768d21b3c79178b"
    },
    {
      "path": "exports/alto/mf_0014.xml",
      "role": "exports",
      "sha256": "476e7744196313fabac6bce5c6cb67583ce126d33a8cfd264ea503e91abcb8ff"
    },
    {
      "path": "exports/alto/mf_0015.xml",
      "role": "exports",
      "sha256": "6189eb38e090aecf48ed10a08f601c8ef587c15e01ff675eb94aecfaa99d6a9e"
    },
    {
      "path": "exports/alto/mf_0016.xml",
      "role": "exports",
      "sha256": "b8a3f2708ef140118e60e42e76c325ae0fc6027cbce0fa69ffdf74ca25bf243e"
    },
    {
      "path": "exports/alto/mf_0017.xml",
      "role": "exports",
      "sha256": "18650f4a7593609584b7c42c18e4cbc2e077cffc8292bb421764b0f64861a9f1"
    },
    {
      "path": "exports/alto/mf_0018.xml",
      "role": "exports",
      "sha256": "0f3ed7aa255ff454f1a1bf35ce20fa5521e7487abeeb30c6febd954f43c6c8d0"
    },
    {
      "path": "exports/alto/mf_0019.xml",
      "role": "exports",
      "sha256": "d88e257ff2035b072180cc60c1d1c5d357354196e75b397af2894801f64f8da4"
    },
    {
      "path": "exports/alto/mf_0020.xml",
      "role": "exports",
      "sha256": "57333bb368a75611faab18c14f95164891839616e4295fda8eef8dfcbb83ee63"
    },
    {
      "path": "exports/alto/mf_0021.xml",
      "role": "exports",
      "sha256": "6f108f1c66e37d55167c2f7449542735d1c0854d735a76ed397ed35d57215f77"
    },
    {
      "path": "exports/alto/mf_0022.xml",
      "role": "exports",
      "sha256": "bb8a399ec0d40828a7c5ad7e99958357360af82b6df11db555100b8a140e3338"
    },
    {
      "path": "exports/alto/mf_0023.xml",
      "role": "exports",
      "sha256": "8cf4c44df641fdd4dd5a1918ab96a624ff47930147824a4938bdf1a1204eddd6"
    },
    {
      "path": "exports/alto/mf_0024.xml",
      "role": "exports",
      "sha256": "4f6ff6a31a200d3d7c201d7fab5c5995b91d6d524bf203b983ca8f5a4c6b9378"
    },
    {
      "path": "exports/alto/mf_0025.xml",
      "role": "exports",
      "sha256": "6a72177026261e4a3f91e2d05b339d45cba478a3edf09015f80f7179f7063915"
    },
    {
      "path": "exports/alto/mf_0026.xml",
      "role": "exports",
      "sha256": "63170a8f2e5e7f611dd6562d431629dcf92ebc1c30353b3087a083a8fa6c972f"
    },
    {
      "path": "exports/alto/mf_0027.xml",
      "role": "exports",
      "sha256": "4655447339afbcce7c1b05eca52fa902ed38cd35d4b73502ec26479fc3993039"
    },
    {
      "path": "exports/alto/mf_0028.xml",
      "role": "exports",
      "sha256": "252048ece4bdb5def8502f6abd65f41a232c7622660b46b5ef73f623c3b8a0ce"
    },
    {
      "path": "exports/alto/mf_0029.xml",
      "role": "exports",
      "sha256": "bca05d754b3ff52a82e86cf04f3cce51ff47eb274e64d39039d77d116e9b645f"
    },
    {
      "path": "exports/alto/mf_0030.xml",
      "role": "exports",
      "sha256": "54870cb2bde54d5deefebb6e2a3494e3b14fdf3c6d6304e3082e41e9456f70be"
    },
    {
      "path": "exports/alto/mf_0031.xml",
      "role": "exports",
      "sha256": "3a6bb9febb56ddfa17eea4e63eb57d8e093972b24a7ea9b60783a29bb8aa4ff7"
    },
    {
      "path": "exports/alto/mf_0032.xml",
      "role": "exports",
      "sha256": "ede214713405c6105e7c6b5c6a4fef8e093e1c5939f81f3011d14cc7e761eaf4"
    },
    {
      "path": "exports/alto/mf_0033.xml",
      "role": "exports",
      "sha256": "822cb8c173e863642f8ed0c9772a735a594b49cab7167ef49a0e1a72ad92f9f3"
    },
    {
      "path": "exports/alto/mf_0034.xml",
      "role": "exports",
      "sha256": "9fbf8a535cc05656c910559655ae84028014a30cae31f74d887f381814787f61"
    },
    {
      "path": "exports/alto/mf_0035.xml",
      "role": "exports",
      "sha256": "81c01aeb776936495ff502cb89d67655c52294ad72b50ada99b9cc7aaf4a511f"
    },
    {
      "path": "exports/alto/mf_0036.xml",
      "role": "exports",
      "sha256": "5b6c13f01016f07400a40fbe874c5a32dcde71aec63f1adcfafa53807db66922"
    },
    {
      "path": "exports/alto/mf_0037.xml",